{"$id":"QK_GBFP8_HEAD64_GRANULARITY_SWEEP_EXECUTION_V8_LEDGER_SCHEMA","$schema":"https://json-schema.org/draft/2020-12/schema","additionalProperties":false,"properties":{"action_id":{"const":"ace2:qk-gbfp8-base-v8:execute-once:2254dd91:20260813T1614Z"},"action_retired":{"const":true},"artifact_kind":{"const":"qk_gbfp8_head64_granularity_sweep_execution_v8_consumed_ledger"},"authority_sha256":{"pattern":"^[0-9a-f]{64}$","type":"string"},"consumed_ledger_sha256":{"pattern":"^[0-9a-f]{64}$","type":"string"},"credential_consumption":{"additionalProperties":false,"properties":{"credential_sha256":{"pattern":"^[0-9a-f]{64}$","type":"string"},"state":{"const":"CONSUMED_BEFORE_PAYLOAD"}},"required":["credential_sha256","state"],"type":"object"},"execution_package_file_sha256":{"pattern":"^[0-9a-f]{64}$","type":"string"},"invocation_cardinality":{"additionalProperties":false,"properties":{"invocation_count_performed_at_publish":{"const":0},"invocation_count_permitted":{"const":1}},"required":["invocation_count_performed_at_publish","invocation_count_permitted"],"type":"object"},"payload_cardinality":{"additionalProperties":false,"properties":{"payload_open_count_performed_at_publish":{"const":0},"payload_open_count_permitted":{"const":1}},"required":["payload_open_count_performed_at_publish","payload_open_count_permitted"],"type":"object"},"post_consumption_ambiguity_default":{"const":"CONSUMED_ORPHAN"},"replay_permitted":{"const":false},"retry_replay_resume_repair_replacement_permitted":{"const":false}},"required":["action_id","action_retired","artifact_kind","authority_sha256","consumed_ledger_sha256","credential_consumption","execution_package_file_sha256","invocation_cardinality","payload_cardinality","post_consumption_ambiguity_default","replay_permitted","retry_replay_resume_repair_replacement_permitted"],"type":"object"}
