{"action_id":"ace2:qk-gbfp8-base-v8:execute-once:2254dd91:20260813T1614Z","action_retired":true,"artifact_kind":"qk_gbfp8_head64_granularity_sweep_execution_v8_consumed_ledger","authority_sha256":"a8609d4cdc35e7d84d1cdb3ee80f771600fd7693f20751443b3679b11f722811","consumed_ledger_sha256":"0b47e556b1f4e08b55e6b8b50211cb3b110714da2cb06da6a3936dc3771dc363","credential_consumption":{"credential_sha256":"82ebc5123615a6b24b793b48ad6fbc19cbab3a7bdb5ba5266aab7c2a0fe90dfa","state":"CONSUMED_BEFORE_PAYLOAD"},"execution_package_file_sha256":"dc03586e17db25a199d9564189b34616d314372c5373fc4f2901c57182363ea6","invocation_cardinality":{"invocation_count_performed_at_publish":0,"invocation_count_permitted":1},"payload_cardinality":{"payload_open_count_performed_at_publish":0,"payload_open_count_permitted":1},"post_consumption_ambiguity_default":"CONSUMED_ORPHAN","replay_permitted":false,"retry_replay_resume_repair_replacement_permitted":false}
